{"$schema":"https://json-schema.org/draft/2020-12/schema","$id":"urn:aicontrolcenter:governance:v1:authorization-decision","title":"GovernanceAuthorizationDecision","type":"object","additionalProperties":false,"required":["schema_version","decision_id","request_id","approver","decision","reason_codes","decided_at","expiry","approved_scope","approved_mutation_budget_id","precondition_snapshot_digest"],"properties":{"schema_version":{"const":"governance/v1"},"decision_id":{"$ref":"#/$defs/text"},"request_id":{"$ref":"#/$defs/text"},"approver":{"$ref":"#/$defs/identity"},"decision":{"enum":["APPROVED","REJECTED"]},"reason_codes":{"type":"array","minItems":1,"uniqueItems":true,"items":{"$ref":"#/$defs/code"}},"decided_at":{"type":"string","format":"date-time"},"expiry":{"oneOf":[{"type":"string","format":"date-time"},{"type":"null"}]},"approved_scope":{"oneOf":[{"type":"array","minItems":1,"uniqueItems":true,"items":{"$ref":"#/$defs/text"}},{"type":"null"}]},"approved_mutation_budget_id":{"$ref":"#/$defs/nullableText"},"precondition_snapshot_digest":{"$ref":"#/$defs/nullableText"}},"allOf":[{"if":{"properties":{"decision":{"const":"APPROVED"}}},"then":{"properties":{"expiry":{"type":"string"},"approved_scope":{"type":"array"},"approved_mutation_budget_id":{"$ref":"#/$defs/text"},"precondition_snapshot_digest":{"$ref":"#/$defs/text"}}}}],"$defs":{"text":{"type":"string","minLength":1},"nullableText":{"oneOf":[{"$ref":"#/$defs/text"},{"type":"null"}]},"code":{"type":"string","pattern":"^[A-Z][A-Z0-9]*(?:_[A-Z0-9]+)*$"},"identity":{"type":"object","additionalProperties":false,"required":["identity_id","identity_type"],"properties":{"identity_id":{"$ref":"#/$defs/text"},"identity_type":{"$ref":"#/$defs/text"}}}}}
