{"schema_version":"governance/v1","decision_id":"decision-synthetic-001","request_id":"request-synthetic-001","approver":{"identity_id":"approver-synthetic","identity_type":"HUMAN"},"decision":"APPROVED","reason_codes":["SCOPE_APPROVED"],"decided_at":"2026-08-10T00:02:00+00:00","expiry":"2026-08-10T01:02:00+00:00","approved_scope":["DOCS:UPDATE"],"approved_mutation_budget_id":"budget-synthetic-001","precondition_snapshot_digest":"digest-snapshot-synthetic-001"}
